[
  {
    "id": "search-wd73-q02",
    "title": "王道 7.3 节习题 02",
    "source": "王道《2026 年数据结构考研复习指导》7.3 节习题 02",
    "difficulty": "基础",
    "topics": [
      "二叉排序树",
      "中序遍历"
    ],
    "targetId": "search-wd73-q02",
    "stem": "按（ ）遍历二叉排序树得到的序列是一个有序序列。",
    "options": [
      "先序",
      "中序",
      "后序",
      "层次"
    ],
    "answer": 1,
    "explanation": "二叉排序树的不变量是“左子树所有关键字 < 根 < 右子树所有关键字”。中序遍历按“左 → 根 → 右”访问，小于根的部分全部先输出，再输出根，最后输出大于根的部分，递归成立，故得到全局升序序列。先序（先根）、后序（后根）与层次遍历都不满足这一顺序约束，选 B。"
  },
  {
    "id": "search-wd73-q04",
    "title": "王道 7.3 节习题 04",
    "source": "王道《2026 年数据结构考研复习指导》7.3 节习题 04",
    "difficulty": "基础",
    "topics": [
      "二叉排序树",
      "存储结构"
    ],
    "targetId": "search-wd73-q04",
    "stem": "在常用的描述二叉排序树的存储结构中，关键字值最大的结点（ ）。",
    "options": [
      "左指针一定为空",
      "右指针一定为空",
      "左右指针均为空",
      "左右指针均不为空"
    ],
    "answer": 1,
    "explanation": "最大关键字结点位于树的“最右下”位置。若它的右指针非空，右子树中所有关键字都比它大，与“最大”矛盾，所以右指针一定为空。但它可以拥有左子树：例如 `10(_,14(12,_))` 中关键字 14 最大，其右指针为空、左指针指向 12。因此“左右指针均为空”不成立，选 B。"
  },
  {
    "id": "search-wd73-q06",
    "title": "王道 7.3 节习题 06",
    "source": "王道《2026 年数据结构考研复习指导》7.3 节习题 06",
    "difficulty": "进阶",
    "topics": [
      "二叉排序树",
      "插入构造"
    ],
    "targetId": "search-wd73-q06",
    "stem": "分别以下列序列构造二叉排序树，与其他 3 个序列所构造的结果不同的是（ ）。",
    "options": [
      "(100, 80, 90, 60, 120, 110, 130)",
      "(100, 120, 110, 130, 80, 60, 90)",
      "(100, 60, 80, 90, 120, 110, 130)",
      "(100, 80, 60, 90, 120, 130, 110)"
    ],
    "answer": 2,
    "explanation": "四个序列的根都是 100，左子树关键字集合都是 {60, 80, 90}、右子树都是 {110, 120, 130}，差别只在子树形态。A、B、D 中左右子树的第一批插入关键字分别以 80 和 120 开头，得到左子树 `80(60, 90)`、右子树 `120(110, 130)`。C 中 60 先于 80 插入，左子树成为 `60(_, 80(_, 90))` 的斜树，形态不同，选 C。"
  },
  {
    "id": "search-wd73-q07",
    "title": "王道 7.3 节习题 07",
    "source": "王道《2026 年数据结构考研复习指导》7.3 节习题 07",
    "difficulty": "基础",
    "topics": [
      "二叉排序树",
      "查找路径",
      "比较次数"
    ],
    "targetId": "search-wd73-q07",
    "stem": "从空树开始，依次插入元素 52, 26, 14, 32, 71, 60, 93, 58, 24, 41 后构成了一棵二叉排序树。在该树中查找 60 需要进行的比较次数为（ ）。",
    "options": [
      "3",
      "4",
      "5",
      "6"
    ],
    "answer": 0,
    "explanation": "按次序插入后的树形为 `52(26(14(_,24), 32(_,41)), 71(60(_,58), 93))`。查找 60 从根出发：52（60 > 52 向右）→ 71（60 < 71 向左）→ 60（命中），共比较 3 次，选 A。"
  },
  {
    "id": "search-wd73-q09",
    "title": "王道 7.3 节习题 09",
    "source": "王道《2026 年数据结构考研复习指导》7.3 节习题 09",
    "difficulty": "进阶",
    "topics": [
      "二叉排序树",
      "形态计数"
    ],
    "targetId": "search-wd73-q09",
    "stem": "五个不同结点构成的二叉查找树的形态共有（ ）种。",
    "options": [
      "20",
      "30",
      "32",
      "42"
    ],
    "answer": 3,
    "explanation": "n 个互异关键字的二叉排序树：中序序列固定为升序，而中序 + 先序可唯一确定一棵二叉树，因此每种树形恰好对应一个合法的先序插入序列，树形数就是 n 个结点二叉树的形态数，即 Catalan 数 $C_5=\\frac{1}{6}\\binom{8}{3}=42$，选 D。"
  },
  {
    "id": "search-wd73-q10",
    "title": "王道 7.3 节习题 10",
    "source": "王道《2026 年数据结构考研复习指导》7.3 节习题 10",
    "difficulty": "基础",
    "topics": [
      "二叉排序树",
      "树高"
    ],
    "targetId": "search-wd73-q10",
    "stem": "构造一棵具有 n 个结点的二叉排序树时，最理想情况下的深度为（ ）。",
    "options": [
      "n/2",
      "n",
      "$\\lfloor\\log_2(n+1)\\rfloor$",
      "$\\lceil\\log_2(n+1)\\rceil$"
    ],
    "answer": 3,
    "explanation": "最理想即树尽量满：深度为 h 的二叉树最多容纳 $2^h-1$ 个结点，故容纳 n 个结点至少需要 $h=\\lceil\\log_2(n+1)\\rceil$ 层。把关键字排序后取中点逐层构造，BST 可以达到这一下界。C 选项只在 $n=2^h-1$（正好满树）时才对，一般 n 会偏小，选 D。"
  },
  {
    "id": "search-408-2024-q07",
    "title": "2024 年 408 真题第 7 题",
    "source": "2024 年 408 真题第 7 题",
    "difficulty": "基础",
    "topics": [
      "二叉搜索树",
      "关键字取值范围"
    ],
    "targetId": "search-408-2024-q07",
    "stem": "一棵二叉搜索树如题 7 图所示，k1、k2、k3 分别是对应结点中保存的关键字。子树 T 的任一结点中保存的关键字 x 满足的是（ ）。\n\n```text\nk1(_, k2(k3(_, T), _))\n```\n\n> **结构（文字版）**：根为 k1（左子树省略），右孩子为 k2；k2 的左孩子为 k3、右子树省略；k3 的左子树省略，右子树即 T。",
    "options": [
      "x < k1",
      "x > k2",
      "k1 < x < k3",
      "k3 < x < k2"
    ],
    "answer": 3,
    "explanation": "T 是 k3 的右子树，故 $x > k_3$；k3 是 k2 的左孩子，T 整体位于 k2 的左子树内，故 $x < k_2$。合起来 $k_3 < x < k_2$，选 D。A、B、C 都只顾一条约束或方向写反。"
  },
  {
    "id": "search-408-2020-q05",
    "title": "2020 年 408 真题第 5 题",
    "source": "2020 年 408 真题第 5 题",
    "difficulty": "基础",
    "topics": [
      "二叉排序树",
      "插入序列"
    ],
    "targetId": "search-408-2020-q05",
    "stem": "下列给定的关键字输入序列中，不能生成如下二叉排序树的是（ ）。\n\n```text\n4(2(1, 3), 5)\n```\n\n> **结构（文字版）**：根 4，左孩子 2（其左右孩子分别为 1、3），右孩子 5。",
    "options": [
      "4, 5, 2, 1, 3",
      "4, 5, 1, 2, 3",
      "4, 2, 5, 3, 1",
      "4, 2, 1, 3, 5"
    ],
    "answer": 1,
    "explanation": "图中 2 必须是 4 的左孩子。B 序列插入 1 时 4 的左孩子尚为空，1 直接成为 4 的左孩子，随后 2、3 只能挂在 1 的右侧，得到 `4(5, 1(_, 2(_, 3)))`，与题图不符。A、C、D 逐项模拟均可得到题图树形，选 B。"
  },
  {
    "id": "search-408-2018-q06",
    "title": "2018 年 408 真题第 6 题",
    "source": "2018 年 408 真题第 6 题",
    "difficulty": "基础",
    "topics": [
      "二叉排序树",
      "关键字大小关系"
    ],
    "targetId": "search-408-2018-q06",
    "stem": "已知二叉排序树如下图所示，元素之间应满足的大小关系是（ ）。\n\n```text\nx1(_, x2(x3(_, x4(x5, _)), _))\n```\n\n> **结构（文字版）**：根 x1 只有右孩子 x2；x2 只有左孩子 x3；x3 只有右孩子 x4；x4 只有左孩子 x5。",
    "options": [
      "x1 < x2 < x5",
      "x1 < x4 < x5",
      "x3 < x5 < x4",
      "x4 < x3 < x5"
    ],
    "answer": 2,
    "explanation": "沿查找路径逐段列不等式：x2 在 x1 右子树，$x_2>x_1$；x3 在 x2 左子树，$x_1<x_3<x_2$；x4 是 x3 的右孩子，$x_3<x_4<x_2$；x5 是 x4 的左孩子，$x_3<x_5<x_4$。因此 $x_3<x_5<x_4$ 成立，选 C。"
  },
  {
    "id": "search-wd73-q05",
    "title": "王道 7.3 节习题 05",
    "source": "王道《2026 年数据结构考研复习指导》7.3 节习题 05",
    "difficulty": "进阶",
    "topics": [
      "二叉排序树",
      "查找路径"
    ],
    "targetId": "search-wd73-q05",
    "stem": "设二叉排序树中关键字由 1 到 1000 的整数构成，现要查找关键字为 363 的结点。下述关键字序列中，不可能是二叉排序树上查找序列的是（ ）。",
    "options": [
      "2, 252, 401, 398, 330, 344, 397, 363",
      "924, 220, 911, 244, 898, 258, 362, 363",
      "925, 202, 911, 240, 912, 245, 363",
      "2, 399, 387, 219, 266, 382, 381, 278, 363"
    ],
    "answer": 2,
    "explanation": "查找路径上每比较一次，后续候选就被限制在更小的上下界内。C 中比较 911 后走向其左孩子 240，此后所有被比较的关键字都必须小于 911，但序列随后出现 912 > 911，矛盾，故 C 不可能。A、B、D 逐项检查都满足沿途形成的上下界，选 C。"
  },
  {
    "id": "search-408-2011-q07",
    "title": "2011 年 408 真题第 7 题",
    "source": "2011 年 408 真题第 7 题",
    "difficulty": "基础",
    "topics": [
      "二叉排序树",
      "查找路径"
    ],
    "targetId": "search-408-2011-q07",
    "stem": "对于下列关键字序列，不可能构成某二叉排序树中一条查找路径的序列是（ ）。",
    "options": [
      "95, 22, 91, 24, 94, 71",
      "92, 20, 91, 34, 88, 35",
      "21, 89, 77, 29, 36, 38",
      "12, 25, 71, 68, 33, 34"
    ],
    "answer": 0,
    "explanation": "A 中比较 91 后走向其左孩子 24，此后所有被比较的关键字都必须小于 91；但序列随后出现 94 > 91，矛盾。B、C、D 中每个关键字都落在前序比较形成的上下界内，可以构成查找路径，选 A。"
  },
  {
    "id": "search-408-2013-q06",
    "title": "2013 年 408 真题第 6 题",
    "source": "2013 年 408 真题第 6 题",
    "difficulty": "进阶",
    "topics": [
      "二叉排序树",
      "删除与插入"
    ],
    "targetId": "search-408-2013-q06",
    "stem": "在任意一棵非空二叉排序树 T1 中，删除某结点 v 之后形成二叉排序树 T2，再将 v 插入 T2 形成二叉排序树 T3。下列关于 T1 与 T3 的叙述中，正确的是（ ）。\n\nI. 若 v 是 T1 的叶结点，则 T1 与 T3 不同\n\nII. 若 v 是 T1 的叶结点，则 T1 与 T3 相同\n\nIII. 若 v 不是 T1 的叶结点，则 T1 与 T3 不同\n\nIV. 若 v 不是 T1 的叶结点，则 T1 与 T3 相同",
    "options": [
      "仅 I、III",
      "仅 I、IV",
      "仅 II、III",
      "仅 II、IV"
    ],
    "answer": 2,
    "explanation": "插入总是以叶结点身份发生。若 v 是叶结点：删除后树形不变，重新插入 v 沿同样路径落回原位置，T1 与 T3 相同，II 对 I 错。若 v 不是叶结点：删除后其位置由孩子或后继填补，重新插入时 v 变成某个新的叶结点，位置不同于原来，T1 与 T3 不同，III 对 IV 错。选 C。"
  }
]
