[
  {
    "id": "ds-generalized-list-001",
    "title": "广义表与线性表的区别",
    "source": "王道《数据结构》考研复习指导",
    "difficulty": "★",
    "topics": ["广义表", "基本概念"],
    "stem": "广义表与线性表的本质区别在于（ ）。",
    "options": [
      "广义表的元素既可以是原子，也可以是子表；线性表的元素只能是原子",
      "广义表不能是空表",
      "线性表不能共享或递归引用自身",
      "广义表只能采用链式存储"
    ],
    "answer": 0,
    "explanation": "广义表的元素既可以是原子也可以是子表，这是它与线性表（元素只能是原子）的本质区别；$E=(a,E)$ 说明广义表可被共享和递归引用，从而表示层次甚至无限的结构。"
  },
  {
    "id": "ds-generalized-list-002",
    "title": "表头与表尾的定义",
    "source": "王道《数据结构》考研复习指导",
    "difficulty": "★",
    "topics": ["广义表", "表头", "表尾"],
    "stem": "下面关于广义表的说法中，不正确的是（ ）。",
    "options": [
      "广义表的表头总是一个广义表",
      "广义表的表尾总是一个广义表",
      "广义表难以用顺序存储结构表示",
      "广义表可以是一个多层次的结构"
    ],
    "answer": 0,
    "explanation": "表尾是去掉表头后剩余元素组成的表，一定是广义表；但表头是第一个元素，可以是原子（如 $(a,b)$ 的表头是原子 $a$），也可以是子表，不一定总是广义表。"
  },
  {
    "id": "ds-generalized-list-003",
    "title": "表头的取值",
    "source": "王道《数据结构》考研复习指导",
    "difficulty": "★",
    "topics": ["广义表", "表头"],
    "stem": "广义表 $((a,b,c),d)$ 的表头是（ ）。",
    "options": ["$a$", "$()$", "$(a,b,c,d)$", "$(a,b,c)$"],
    "answer": 3,
    "explanation": "表头是非空广义表的第一个元素，这里第一个元素是子表 $(a,b,c)$，故表头为 $(a,b,c)$。"
  },
  {
    "id": "ds-generalized-list-004",
    "title": "Tail 运算的结果",
    "source": "王道《数据结构》考研复习指导",
    "difficulty": "★",
    "topics": ["广义表", "表尾"],
    "stem": "广义表 $L=(a,(b,c))$，进行 $Tail(L)$ 操作后的结果为（ ）。",
    "options": ["$c$", "$b,c$", "$(b,c)$", "$((b,c))$"],
    "answer": 3,
    "explanation": "表尾是去掉表头 $a$ 后剩余元素组成的表：剩余元素只有子表 $(b,c)$，但还要套在原表里，故 $Tail(L)=((b,c))$，比直觉多一层括号。"
  },
  {
    "id": "ds-generalized-list-005",
    "title": "长度与深度的计算",
    "source": "王道《数据结构》考研复习指导",
    "difficulty": "★★",
    "topics": ["广义表", "长度", "深度"],
    "stem": "设广义表 $L=((a,b,c),d)$，则 $L$ 的长度和深度分别为（ ）。",
    "options": ["1 和 2", "2 和 2", "2 和 3", "1 和 3"],
    "answer": 1,
    "explanation": "长度数最外层元素个数：$L$ 有 $(a,b,c)$ 与 $d$ 两个元素，长度 2；深度数括号最大层次：最外层一层 + 内层 $(a,b,c)$ 一层 = 2。"
  },
  {
    "id": "ds-generalized-list-006",
    "title": "深度的计算",
    "source": "王道《数据结构》考研复习指导",
    "difficulty": "★★",
    "topics": ["广义表", "深度"],
    "stem": "设广义表 $F=(a,(b,(c,d)))$，则 $depth(F)$ 为（ ）。",
    "options": ["1", "2", "3", "4"],
    "answer": 2,
    "explanation": "最内层 $(c,d)$ 深度为 1，$(b,(c,d))$ 深度为 2，最外层再加一层，故 $depth(F)=3$。"
  },
  {
    "id": "ds-generalized-list-007",
    "title": "Head 与 Tail 的组合运算",
    "source": "严蔚敏《数据结构》习题",
    "difficulty": "★★★",
    "topics": ["广义表", "表头", "表尾"],
    "stem": "设广义表 $A=(a,b,(c,d),(e,(f,g)))$，则 $Head(Tail(Head(Tail(Tail(A)))))$ 的值为（ ）。",
    "options": ["$(g)$", "$(d)$", "$c$", "$d$"],
    "answer": 3,
    "explanation": "从内到外拆解：$Tail(A)=(b,(c,d),(e,(f,g)))$；再取 $Tail$ 得 $((c,d),(e,(f,g)))$；取 $Head$ 得 $(c,d)$；取 $Tail$ 得 $(d)$；最后取 $Head$ 得 $d$。"
  },
  {
    "id": "ds-generalized-list-008",
    "title": "广义表的存储结构",
    "source": "王道《数据结构》考研复习指导",
    "difficulty": "★★",
    "topics": ["广义表", "存储结构"],
    "stem": "关于广义表的存储，下列说法错误的是（ ）。",
    "options": [
      "头尾链表与扩展线性链表都用标志位区分原子与子表",
      "头尾链表中空表用空指针表示",
      "扩展线性链表比头尾链表更节省空间",
      "扩展线性链表用 $next$ 指针串起同一层元素"
    ],
    "answer": 2,
    "explanation": "扩展线性链表每个结点多一个 $next$ 指针，空间开销更大（并非更省）；其余均正确：两种表示都用标志位区分原子与子表、头尾链表中空表用空指针表示、扩展线性链表用 $next$ 串起同层元素便于顺序遍历。"
  },
  {
    "id": "ds-generalized-list-009",
    "title": "广义表的递归定义",
    "source": "王道《数据结构》考研复习指导",
    "difficulty": "★",
    "topics": ["广义表", "递归", "基本概念"],
    "stem": "设广义表 $E=(a,E)$，下列说法正确的是（ ）。",
    "options": [
      "$E$ 的长度为 2，含原子 $a$ 和它本身的引用，是递归表",
      "$E$ 是空表",
      "$E$ 的长度为 1",
      "$E$ 是不合法的广义表"
    ],
    "answer": 0,
    "explanation": "$E=(a,E)$ 有两个元素：原子 $a$ 和对 $E$ 自身的引用，长度 2，是递归表，可展开为 $(a,(a,(a,\\dots)))$，说明广义表可被递归引用。"
  },
  {
    "id": "ds-generalized-list-010",
    "title": "用 Head/Tail 取出原子",
    "source": "王道《数据结构》考研复习指导",
    "difficulty": "★★★",
    "topics": ["广义表", "表头", "表尾"],
    "stem": "设广义表 $L=((x,y,z),a,(u,t,w))$，从 $L$ 中取出原子 $t$ 的运算是（ ）。",
    "options": [
      "$Head(Tail(Tail(L)))$",
      "$Tail(Head(Tail(L)))$",
      "$Head(Tail(Head(Tail(L))))$",
      "$Head(Tail(Head(Tail(Tail(L)))))$"
    ],
    "answer": 3,
    "explanation": "$Tail(L)=(a,(u,t,w))$；$Tail(Tail(L))=((u,t,w))$；$Head(Tail(Tail(L)))=(u,t,w)$；$Tail(Head(Tail(Tail(L))))=(t,w)$；$Head(Tail(Head(Tail(Tail(L)))))=t$。"
  },
  {
    "id": "ds-generalized-list-011",
    "title": "表尾的类型",
    "source": "课程自编",
    "difficulty": "★",
    "topics": ["广义表", "表尾"],
    "stem": "对非空广义表 $L$ 执行 Tail(L)，结果一定是（ ）。",
    "options": ["一个表", "一个原子", "一个整数", "空指针以外的原子"],
    "answer": 0,
    "explanation": "表尾由去掉表头后的剩余元素重新组成，仍然是一个表，可能是空表。"
  },
  {
    "id": "ds-generalized-list-012",
    "title": "单元素表的表尾",
    "source": "课程自编",
    "difficulty": "★",
    "topics": ["广义表", "表尾"],
    "stem": "Tail((a)) 的结果是（ ）。",
    "options": ["()", "a", "(a)", "((a))"],
    "answer": 0,
    "explanation": "去掉唯一的表头 a 后，剩余元素为空，表尾是空表 ()，不能写成原子 a。"
  },
  {
    "id": "ds-generalized-list-013",
    "title": "表头可能是子表",
    "source": "课程自编",
    "difficulty": "★",
    "topics": ["广义表", "表头"],
    "stem": "Head(((a,b),c)) 的结果是（ ）。",
    "options": ["(a,b)", "((a,b))", "c", "()"],
    "answer": 0,
    "explanation": "最外层表的第一个元素本身是子表 (a,b)，因此表头仍是一个表。"
  },
  {
    "id": "ds-generalized-list-014",
    "title": "广义表长度",
    "source": "课程自编",
    "difficulty": "★",
    "topics": ["广义表", "长度"],
    "stem": "广义表 $L=(a,(b,c),d)$ 的长度是（ ）。",
    "options": ["3", "4", "2", "5"],
    "answer": 0,
    "explanation": "长度只统计最外层元素个数，分别是 a、(b,c)、d，共 3 个。"
  },
  {
    "id": "ds-generalized-list-015",
    "title": "广义表深度",
    "source": "课程自编",
    "difficulty": "★★",
    "topics": ["广义表", "深度"],
    "stem": "按本文约定，原子的深度为（ ）。",
    "options": ["0", "1", "-1", "原子个数"],
    "answer": 0,
    "explanation": "原子不能再拆分，是递归终点，深度约定为 0；空表深度约定为 1。"
  },
  {
    "id": "ds-generalized-list-016",
    "title": "空表深度",
    "source": "课程自编",
    "difficulty": "★",
    "topics": ["广义表", "深度"],
    "stem": "按本文约定，空表 () 的深度是（ ）。",
    "options": ["1", "0", "-1", "无法定义"],
    "answer": 0,
    "explanation": "为了让递归定义统一，空表深度约定为 1。"
  },
  {
    "id": "ds-generalized-list-017",
    "title": "深度递归终止",
    "source": "课程自编",
    "difficulty": "★",
    "topics": ["广义表", "递归"],
    "stem": "求广义表深度时，递归应在哪些对象处终止？",
    "options": ["原子和空表", "所有非空表", "只有根表", "只有原子"],
    "answer": 0,
    "explanation": "原子深度为 0，空表深度为 1，二者都不能继续拆分。"
  },
  {
    "id": "ds-generalized-list-018",
    "title": "头尾链表指针",
    "source": "课程自编",
    "difficulty": "★★",
    "topics": ["广义表", "头尾链表"],
    "stem": "在头尾链表表示中，List 节点的 hp 和 tp 分别指向（ ）。",
    "options": ["表头和表尾", "表尾和表头", "同层下一个元素和父表", "行和列"],
    "answer": 0,
    "explanation": "hp 指向表头元素，tp 指向表尾表，正对应 Head/Tail 的递归定义。"
  },
  {
    "id": "ds-generalized-list-019",
    "title": "广义表存储标志",
    "source": "课程自编",
    "difficulty": "★",
    "topics": ["广义表", "存储结构"],
    "stem": "广义表结点需要 tag 标志位的主要原因是（ ）。",
    "options": ["区分当前结点是原子还是子表", "记录元素的排序位置", "保存表的长度", "避免使用指针"],
    "answer": 0,
    "explanation": "一个结点可能保存原子值，也可能保存 hp/tp 指针，必须用 tag 区分两种解释方式。"
  },
  {
    "id": "ds-generalized-list-020",
    "title": "表尾括号",
    "source": "课程自编",
    "difficulty": "★★",
    "topics": ["广义表", "表尾"],
    "stem": "Tail((a,(b,c))) 的序列化结果是（ ）。",
    "options": ["((b,c))", "(b,c)", "b", "(a)"],
    "answer": 0,
    "explanation": "去掉外层表头 a 后，剩余元素只有子表 (b,c)，重新组成表，所以结果是 ((b,c))。"
  }
]
