[
  {
    "id": "ds-string-basic-001",
    "title": "串的特殊性",
    "source": "严蔚敏《数据结构》习题 ",
    "difficulty": "★",
    "topics": [
      "串",
      "基本概念"
    ],
    "stem": "串是一种特殊的线性表，其特殊性体现在（ ）。",
    "options": [
      "可以顺序存储",
      "数据元素是一个字符",
      "可以链式存储",
      "数据元素可以是多个字符"
    ],
    "answer": 1,
    "explanation": "**定位概念**：串（字符串）是由零个或多个字符组成的有限序列，本质上是线性表，但数据元素被限定为**单个字符**，这正是它区别于一般线性表的地方。\n\n| 选项 | 说法 | 判断 |\n|---|---|---|\n| A 可以顺序存储 | 顺序存储是串的常用存储方式之一 | 不构成“特殊性”（线性表都能顺序存储） |\n| B 数据元素是一个字符 | 串的每个元素是一个字符 | **正确** |\n| C 可以链式存储 | 链式存储也是串的可用存储方式 | 不构成“特殊性” |\n| D 数据元素可以是多个字符 | 串的元素只能是单个字符 | 错误 |\n\n最终答案是 **B（数据元素是一个字符）**。"
  },
  {
    "id": "ds-string-basic-002",
    "title": "串的叙述辨析",
    "source": "严蔚敏《数据结构》习题 ",
    "difficulty": "★",
    "topics": [
      "串",
      "基本概念"
    ],
    "stem": "下面关于串的的叙述中，哪一个是不正确的？（ ）",
    "options": [
      "串是字符的有限序列",
      "空串是由空格构成的串",
      "模式匹配是串的一种重要运算",
      "串既可以采用顺序存储，也可以采用链式存储"
    ],
    "answer": 1,
    "explanation": "**易错点**：空串与空格串是两个不同的概念。\n\n- **空串**：长度为零的串，不包含任何字符，记为 $\\emptyset$ 或 \"\"；\n- **空格串**：由一个或多个空格组成的串，空格本身是字符，因此空格串的长度不小于 1。\n\n选项 B 说“空串是由空格构成的串”，把空串与空格串混为一谈，**不正确**。\n\n其余选项均正确：A 是串的定义；C 中模式匹配（子串定位）确实是串的重要运算；D 中串既可以顺序存储也可以链式存储。\n\n最终答案是 **B（空串是由空格构成的串）**。"
  },
  {
    "id": "ds-string-basic-003",
    "title": "串的长度",
    "source": "严蔚敏《数据结构》习题 ",
    "difficulty": "★",
    "topics": [
      "串",
      "基本概念"
    ],
    "stem": "串的长度是指（ ）。",
    "options": [
      "串中所含不同字符的个数",
      "串中所含非空格字符的个数",
      "串中所含字符的个数",
      "串中所含不同字母的个数"
    ],
    "answer": 2,
    "explanation": "串长（串的长度）定义为串中**字符的个数**，包括空格字符，也不区分字符是否重复。例如 \"How are you\" 的长度是 11（含 2 个空格），而不是只数不同字母或非空格字符。\n\n| 选项 | 说法 | 判断 |\n|---|---|---|\n| A 不同字符的个数 | 只数去重后的字符 | 错误 |\n| B 非空格字符的个数 | 把空格排除在外 | 错误 |\n| C 所含字符的个数 | 全部字符都计入 | **正确** |\n| D 不同字母的个数 | 只数去重后的字母 | 错误 |\n\n最终答案是 **C（串中所含字符的个数）**。"
  },
  {
    "id": "ds-string-basic-004",
    "title": "空串与空格串",
    "source": "巩固题",
    "difficulty": "★",
    "topics": [
      "串",
      "基本概念"
    ],
    "stem": "空串与空格字符构成的串的差别在于（ ）。",
    "options": [
      "没有差别",
      "两串的长度不相等",
      "两串的长度相等",
      "两串包含的字符不同"
    ],
    "answer": 1,
    "explanation": "空串是不含任何字符的串，长度为 **0**；空格串由一个或多个空格组成，空格是普通字符，所以长度**至少为 1**。二者最直接的差别就是**长度不相等**。\n\n- A：二者显然是不同的串，错误；\n- B：空串长度 0，空格串长度 ≥ 1，长度必不相等，**正确**；\n- C：长度不相等，错误；\n- D：“包含的字符不同”本身也是对的，但题目问“差别在于”，教材的标准口径是长度不同（空串无字符、空格串有空格字符，长度自然不同），B 更直接。\n\n最终答案是 **B（两串的长度不相等）**。"
  },
  {
    "id": "ds-string-basic-005",
    "title": "两个串相等的条件",
    "source": "巩固题",
    "difficulty": "★",
    "topics": [
      "串",
      "基本概念"
    ],
    "stem": "两个字符串相等的条件是（ ）。",
    "options": [
      "两串的长度相等",
      "两串包含的字符相同",
      "两串的长度相等，并且两串包含的字符相同",
      "两串的长度相等，并且对应位置上的字符相同"
    ],
    "answer": 3,
    "explanation": "两个串相等，当且仅当**长度相等**且**对应位置上的字符完全相同**。\n\n- A：长度相等但内容可以不同，错误；\n- B：“包含的字符相同”只要求字符集合相同，忽略顺序和重复次数，例如 \"ab\" 与 \"ba\"，错误；\n- C：在 B 的基础上加长度相等，仍没有要求“位置一一对应”，例如 \"ab\" 与 \"ba\" 长度相等、字符集合相同，但串不相等，错误；\n- D：长度相等且逐位对应相同，正是串相等的定义，**正确**。\n\n最终答案是 **D（两串的长度相等，并且对应位置上的字符相同）**。"
  },
  {
    "id": "ds-string-basic-006",
    "title": "连接与求子串的组合运算",
    "source": "李春葆《数据结构》习题",
    "difficulty": "★★",
    "topics": [
      "串",
      "基本操作",
      "求子串",
      "连接"
    ],
    "stem": "设串 $s_1=\\text{'ABCDEFG'}$，$s_2=\\text{'PQRST'}$。函数 $\\text{con}(x,y)$ 返回 $x$ 和 $y$ 连接后的串，$\\text{subs}(s,i,j)$ 返回串 $s$ 从序号 $i$ 开始的 $j$ 个字符组成的子串，$\\text{len}(s)$ 返回串 $s$ 的长度，则 $\\text{con}(\\text{subs}(s_1,2,\\text{len}(s_2)),\\ \\text{subs}(s_1,\\text{len}(s_2),2))$ 的结果串是（ ）。",
    "options": [
      "BCDEF",
      "BCDEFG",
      "BCPQRST",
      "BCDEFEF"
    ],
    "answer": 3,
    "explanation": "按运算顺序拆解：\n\n1. $\\text{len}(s_2)=\\text{len}('PQRST')=5$；\n2. $\\text{subs}(s_1,2,5)$：从 $s_1='ABCDEFG'$ 的第 2 个字符起取 5 个字符，得 $'BCDEF'$；\n3. $\\text{subs}(s_1,5,2)$：从第 5 个字符起取 2 个字符，得 $'EF'$；\n4. $\\text{con}('BCDEF','EF')='BCDEFEF'$。\n\n这道题综合考查**求长、求子串、连接**三个基本操作的语义与组合顺序：先算内层函数，再把结果作为连接操作的输入。\n\n最终答案是 **D（BCDEFEF）**。"
  },
  {
    "id": "ds-string-basic-007",
    "title": "子串的数目",
    "source": "长沙理工大学 2018 年 850 数据结构考研真题",
    "difficulty": "★★",
    "topics": [
      "串",
      "子串",
      "考研真题"
    ],
    "stem": "若串 $S=\\text{'SOFTWARE'}$，其子串的数目最多是（ ）。",
    "options": [
      "35",
      "36",
      "37",
      "38"
    ],
    "answer": 2,
    "explanation": "设串长为 $n$，则子串总数（含空串）为 $n(n+1)/2+1$。这里 $n=8$，所以子串数目最多为 $8\\times 9/2+1=37$。\n\n拆开来看：长度为 1 的子串 8 个，长度为 2 的 7 个，……，长度为 8 的 1 个，共 $8+7+\\cdots+1=36$ 个非空子串；空串也算一个子串，故总共 **37** 个。\n\n最终答案是 **C（37）**。"
  },
  {
    "id": "ds-string-basic-008",
    "title": "非空子串个数的最大值",
    "source": "金锄头《数据结构：串期末单元测试》",
    "difficulty": "★★",
    "topics": [
      "串",
      "子串"
    ],
    "stem": "有 $n$ 个字符的字符串，其非空子串个数最多有（ ）。",
    "options": [
      "$n(n-1)/2$",
      "$n-1$",
      "$n$",
      "$n(n+1)/2$"
    ],
    "answer": 3,
    "explanation": "对每个起点位置统计：以第 1 个字符开头的非空子串有 $n$ 个，以第 2 个字符开头的有 $n-1$ 个，……，以最后一个字符开头的有 1 个，总计 $n+(n-1)+\\cdots+1=n(n+1)/2$。\n\n- 若题目要求含空串，则再加 1，为 $n(n+1)/2+1$（上一题“SOFTWARE”即按此口径）；\n- 若字符有重复，按“内容不同才算一个”统计时结果可能更少，“最多”即按所有起点都不同来算。\n\n最终答案是 **D（$n(n+1)/2$）**。"
  },
  {
    "id": "ds-string-basic-009",
    "title": "取子串运算的结果",
    "source": "金锄头《数据结构：串期末单元测试》",
    "difficulty": "★★",
    "topics": [
      "串",
      "基本操作",
      "求子串"
    ],
    "stem": "函数 $\\text{SubStr}(S,m,n)$ 是从 $S$ 的第 $m(>0)$ 个字符开始、连续取 $n$ 个字符构成子串返回的运算。若串 $S=\\text{\"tsinghua\"}$，则 $\\text{SubStr}(S,3,4)$ 抽取的子串是（ ）。",
    "options": [
      "\"ghua\"",
      "\"tsin\"",
      "\"nghu\"",
      "\"ingh\""
    ],
    "answer": 2,
    "explanation": "按 1-based 位置把 $S=\\text{\"tsinghua\"}$ 逐位编号：1:t、2:s、3:n、4:g、5:h、6:u、7:a。$\\text{SubStr}(S,3,4)$ 从第 3 个字符开始连续取 4 个字符，即第 3～6 位：n、g、h、u，得到 $\\text{\"nghu\"}$。\n\n- A \"ghua\" 是从第 4 位起取 4 个；\n- B \"tsin\" 是从第 1 位起取 4 个；\n- D \"ingh\" 是从第 2 位起取 4 个。\n\n最终答案是 **C（\"nghu\"）**。"
  },
  {
    "id": "ds-string-basic-010",
    "title": "串的定义",
    "source": "电大 2022《数据结构（本）》",
    "difficulty": "★",
    "topics": [
      "串",
      "基本概念"
    ],
    "stem": "串是（ ）。",
    "options": [
      "不少于一个字母的序列",
      "任意个字母的序列",
      "不少于一个字符的序列",
      "有限个字符的序列"
    ],
    "answer": 3,
    "explanation": "串（字符串）是由**零个或多个字符组成的有限序列**。\n\n- A：串可以为空（零个字符），且元素是字符而不限于字母，错误；\n- B：“任意个”没有强调有限，且元素是字符不是字母，错误；\n- C：串允许是空串，并非“不少于一个字符”，错误；\n- D：有限个字符的序列，允许零个（空串），元素为字符，**正确**。\n\n最终答案是 **D（有限个字符的序列）**。"
  },
  {
    "id": "ds-string-basic-011",
    "title": "字符串的叙述辨析",
    "source": "2017 年上半年软件设计师考试题 ",
    "difficulty": "★★",
    "topics": [
      "串",
      "基本概念",
      "软考真题"
    ],
    "stem": "以下关于字符串的叙述中，正确的是（ ）。",
    "options": [
      "包含任意个空格字符的字符串称为空串",
      "字符串不是线性数据结构",
      "字符串的长度是指串中所含字符的个数",
      "字符串的长度是指串中所含非空格字符的个数"
    ],
    "answer": 2,
    "explanation": "逐项辨析：\n\n- A：空串是**不含任何字符**、长度为 0 的串；由空格组成的串叫空格串（长度 ≥ 1），错误；\n- B：字符串是仅由字符构成的有限序列，元素按顺序排列、有唯一前驱后继，是典型的**线性数据结构**，错误；\n- C：串长 = 串中**所有字符**的个数，空格也是字符、计入长度，**正确**；\n- D：串长包含空格，不是“非空格字符的个数”，错误。\n\n最终答案是 **C（字符串的长度是指串中所含字符的个数）**。"
  },
  {
    "id": "ds-string-basic-012",
    "title": "存储方式的选择",
    "source": "超星 MOOC《数据结构》串练习",
    "difficulty": "★★",
    "topics": [
      "串",
      "存储结构"
    ],
    "stem": "若串中字符经常发生变化，则采用（ ）存储方式最合适。",
    "options": [
      "定长顺序",
      "堆",
      "链式",
      "散列"
    ],
    "answer": 2,
    "explanation": "“字符经常发生变化”意味着频繁的插入、删除、替换。\n\n- **链式存储**：按需分配结点，整块插入/删除只需修改指针；块内字符插入仍需搬移，但相比顺序存储的大段搬移代价更小，最适应这种动态变化，**正确**；\n- **定长顺序**：存储空间固定，超出预分配长度会截断或溢出，频繁变化时不合适；\n- **堆（堆分配）**：动态分配连续空间，能适应长度变化，但插入/删除仍需移动字符，且空间管理更复杂；\n- **散列**：不是串的常规存储方案，散列函数面向查找，不适合按位置顺序处理串。\n\n最终答案是 **C（链式）**。"
  },
  {
    "id": "ds-string-basic-013",
    "title": "串的两种基本存储",
    "source": "中国科学院大学 2016 考研真题",
    "difficulty": "★★",
    "topics": [
      "串",
      "存储结构",
      "考研真题"
    ],
    "stem": "串的两种基本的存储方式是（ ）。",
    "options": [
      "顺序存储和链式存储",
      "顺序存储和堆存储",
      "堆存储和链式存储",
      "堆存储和数组存储"
    ],
    "answer": 0,
    "explanation": "按存储介质分类，串的两种**基本**存储方式是**顺序存储**和**链式存储**：\n\n- **顺序存储**：用一组地址连续的存储单元存放串值，又分为定长顺序存储（静态数组）与堆分配存储（动态申请）；\n- **链式存储**：用链表存放串，每个结点可存一个或多个字符（结点大小）。\n\n“堆存储”是顺序存储的一种实现形式（动态分配连续空间），与顺序存储不是并列关系；“数组”只是顺序存储的载体。因此把“堆”或“数组”与顺序/链式并列的选项都不对。\n\n最终答案是 **A（顺序存储和链式存储）**。"
  },
  {
    "id": "ds-string-basic-014",
    "title": "结点大小为 1 的链串",
    "source": "《数据结构》习题·串",
    "difficulty": "★★",
    "topics": [
      "串",
      "存储结构",
      "链式存储"
    ],
    "stem": "字符串采用结点大小为 1 的链表作为其存储结构，是指（ ）。",
    "options": [
      "链表的长度为 1",
      "链表中只存放 1 个字符",
      "链表的每个链结点的数据域中不仅只存放了一个字符",
      "链表的每个链结点的数据域中只存放了一个字符"
    ],
    "answer": 3,
    "explanation": "链串的“结点大小”指**每个链结点数据域能存放的字符个数**。结点大小为 1，即每个链结点的数据域**只存放一个字符**；串长为 $n$ 时对应 $n$ 个结点（外加可选的链域开销）。\n\n- A：结点大小与链表长度无关；\n- B：整个链表存放所有字符，不可能“只存放 1 个字符”（除非串长就是 1）；\n- C：方向说反了，结点大小为 1 不是“不仅只存放一个字符”；\n- D：每个链结点的数据域只存放一个字符，**正确**。\n\n最终答案是 **D（链表的每个链结点的数据域中只存放了一个字符）**。"
  },
  {
    "id": "ds-string-basic-015",
    "title": "链串的存储密度",
    "source": "巩固题",
    "difficulty": "★★",
    "topics": [
      "串",
      "存储结构",
      "存储密度"
    ],
    "stem": "一个链串的结点类型定义如下：`#define NodeSize 6`；`typedef struct node { char data[NodeSize]; struct node *next; } LinkStrNode;` 如果每个字符占 1 个字节、指针占 2 个字节，该链串的存储密度为（ ）。",
    "options": [
      "1/3",
      "1/2",
      "2/3",
      "3/4"
    ],
    "answer": 3,
    "explanation": "存储密度的定义：**结点中数据占用的字节数 ÷ 结点结构占用的总字节数**。\n\n- 数据域：$6$ 个字符 × 1 字节 = 6 字节；\n- 指针域：1 个指针 × 2 字节 = 2 字节；\n- 结点总字节数 = 6 + 2 = 8 字节。\n\n因此存储密度 $= 6/8 = 3/4$。结点大小越大、数据占比越高，存储密度越大；这也是链串常把结点大小取得较大（如 4 或 6）的原因。\n\n最终答案是 **D（3/4）**。"
  }
]
