[
  {
    "id": "search-wd72-q01",
    "title": "王道 7.2 节习题 01",
    "source": "王道《2026 年数据结构考研复习指导》7.2 节习题 01",
    "difficulty": "基础",
    "topics": [
      "顺序查找",
      "存储结构"
    ],
    "targetId": "search-wd72-q01",
    "stem": "顺序查找适合于存储结构为（ ）的线性表。",
    "options": [
      "顺序存储结构或链式存储结构",
      "散列存储结构",
      "索引存储结构",
      "压缩存储结构"
    ],
    "answer": 0,
    "explanation": "顺序查找从表的一端向另一端逐个比较，只依赖元素的逻辑次序，不要求随机访问，因此顺序存储和链式存储都适用；散列与索引存储各自有专门的查找方式，压缩存储（如对称矩阵的压缩存放）反而破坏了逐个访问的次序。选 A。"
  },
  {
    "id": "search-wd72-q02",
    "title": "王道 7.2 节习题 02",
    "source": "王道《2026 年数据结构考研复习指导》7.2 节习题 02",
    "difficulty": "进阶",
    "topics": [
      "顺序查找",
      "平均时间"
    ],
    "targetId": "search-wd72-q02",
    "stem": "由 n 个数据元素组成的两个表：一个递增有序，一个无序。采用顺序查找算法，对有序表从头开始查找，发现当前元素已不小于待查元素时，停止查找，确定查找不成功。已知查找任意一个元素的概率相同，则在两种表中成功查找（ ）。",
    "options": [
      "平均时间后者小",
      "平均时间两者相同",
      "平均时间前者小",
      "无法确定"
    ],
    "answer": 1,
    "explanation": "成功查找都是从表头逐个比较直到命中：第 i 个元素的比较次数都是 i，等概率下平均都是 (n+1)/2，与表是否有序无关。有序性只影响失败查找——有序表可以在越过待查值的位置提前停止，无序表必须扫完全表。所以成功查找的平均时间两者相同，选 B。"
  },
  {
    "id": "search-wd72-q05",
    "title": "王道 7.2 节习题 05",
    "source": "王道《2026 年数据结构考研复习指导》7.2 节习题 05",
    "difficulty": "基础",
    "topics": [
      "折半查找",
      "前提条件"
    ],
    "targetId": "search-wd72-q05",
    "stem": "下列关于二分查找的叙述中，正确的是（ ）。",
    "options": [
      "表必须有序，表可以顺序方式存储，也可以链表方式存储",
      "表必须有序且表中数据必须是整型、实型或字符型",
      "表必须有序，而且只能从小到大排列",
      "表必须有序，且表只能以顺序方式存储"
    ],
    "answer": 3,
    "explanation": "二分查找要一步跳到区间中点比较，链式存储无法随机访问中点，所以只能顺序存储，D 正确、A 错误；关键字只需能比较大小，与具体类型无关，B 错误；降序有序表同样可以二分，只是比较方向相反，C 错误。选 D。"
  },
  {
    "id": "search-408-2024-q05",
    "title": "2024 年 408 真题第 5 题",
    "source": "2024 年 408 真题第 5 题",
    "difficulty": "基础",
    "topics": [
      "折半查找",
      "存储结构"
    ],
    "targetId": "search-408-2024-q05",
    "stem": "下列数据结构中，不适合直接使用折半查找的是（ ）。\n\nI. 有序链表  \nII. 无序数组  \nIII. 有序静态链表  \nIV. 无序静态链表",
    "options": [
      "仅 I、II",
      "仅 II、IV",
      "仅 I、II、IV",
      "I、II、III、IV"
    ],
    "answer": 3,
    "explanation": "折半查找既要求按关键字有序，也要求能按逻辑下标随机访问。I、III 虽有序，但链式逻辑次序不能直接定位中点；II、IV 又不满足有序前提。因此四种结构都不适合直接折半查找，选 D。"
  },
  {
    "id": "search-408-2010-q09",
    "title": "2010 年 408 真题第 9 题",
    "source": "2010 年 408 真题第 9 题",
    "difficulty": "基础",
    "topics": [
      "折半查找",
      "比较次数"
    ],
    "targetId": "search-408-2010-q09",
    "stem": "已知一个长度为 16 的顺序表 L，其元素按关键字有序排列。若采用折半查找法查找一个 L 中不存在的元素，则关键字的比较次数最多是（ ）。",
    "options": [
      "4",
      "5",
      "6",
      "7"
    ],
    "answer": 1,
    "explanation": "折半查找每次比较后至多排除约一半候选。含 n 个元素的折半判定树高度为 $\\lfloor\\log_2 n\\rfloor+1$；当 $n=16$ 时高度为 5。失败查找最深也可能经过 5 个非空结点，所以最多比较 5 次，选 B。"
  },
  {
    "id": "search-408-2023-q08",
    "title": "2023 年 408 真题第 8 题",
    "source": "2023 年 408 真题第 8 题",
    "difficulty": "基础",
    "topics": [
      "折半查找",
      "比较次数"
    ],
    "targetId": "search-408-2023-q08",
    "stem": "对含有 600 个元素的有序顺序表进行折半查找，关键字之间的比较次数最多是（ ）。",
    "options": [
      "9",
      "10",
      "30",
      "300"
    ],
    "answer": 1,
    "explanation": "$2^9=512<600<1024=2^{10}$，9 次比较不足以区分 600 个候选及失败位置；折半判定树高度为 $\\lfloor\\log_2 600\\rfloor+1=10$。因此最多比较 10 次，选 B。"
  },
  {
    "id": "search-wd72-q09",
    "title": "王道 7.2 节习题 09",
    "source": "王道《2026 年数据结构考研复习指导》7.2 节习题 09",
    "difficulty": "基础",
    "topics": [
      "折半查找",
      "比较序列"
    ],
    "targetId": "search-wd72-q09",
    "stem": "在有 11 个元素的有序表 A[1, 2, …, 11] 中进行折半查找（$\\lfloor(\\text{low}+\\text{high})/2\\rfloor$），查找元素 A[11] 时，被比较的元素下标依次是（ ）。",
    "options": [
      "6, 8, 10, 11",
      "6, 9, 10, 11",
      "6, 7, 9, 11",
      "6, 8, 9, 11"
    ],
    "answer": 1,
    "explanation": "low=1、high=11：mid=⌊12/2⌋=6，11 > A[6]，low=7；mid=⌊(7+11)/2⌋=9，11 > A[9]，low=10；mid=⌊(10+11)/2⌋=10，11 > A[10]，low=11；mid=11 命中。被比较的下标依次为 6, 9, 10, 11，选 B。"
  },
  {
    "id": "search-wd72-q12",
    "title": "王道 7.2 节习题 12",
    "source": "王道《2026 年数据结构考研复习指导》7.2 节习题 12",
    "difficulty": "基础",
    "topics": [
      "折半查找",
      "判定树高度"
    ],
    "targetId": "search-wd72-q12",
    "stem": "对长度为 n 的有序表进行折半查找，其判定树的高度为（ ）。",
    "options": [
      "$\\lceil\\log_2(n+1)\\rceil$",
      "$\\lfloor\\log_2(n+1)\\rfloor-1$",
      "$\\lceil\\log_2 n\\rceil$",
      "$\\lfloor\\log_2 n\\rfloor-1$"
    ],
    "answer": 0,
    "explanation": "判定树第 h 层最多有 $2^{h-1}$ 个结点，n 个结点、高度 h 满足 $2^{h-1}-1<n\\le 2^h-1$，解得 $h=\\lceil\\log_2(n+1)\\rceil$。验证：n=1 时 h=1；n=4 时 $\\lceil\\log_2 5\\rceil=3$，4 个结点的判定树确实高 3。选 A。"
  },
  {
    "id": "search-wd72-q07",
    "title": "王道 7.2 节习题 07",
    "source": "王道《2026 年数据结构考研复习指导》7.2 节习题 07",
    "difficulty": "基础",
    "topics": [
      "折半查找",
      "判定树"
    ],
    "targetId": "search-wd72-q07",
    "stem": "折半查找过程所对应的判定树是一棵（ ）。",
    "options": [
      "最小生成树",
      "平衡二叉树",
      "完全二叉树",
      "满二叉树"
    ],
    "answer": 1,
    "explanation": "折半查找每次把区间分成结点数至多差 1 的两半，因此判定树中任一结点左右子树高度差的绝对值不超过 1，即判定树是一棵平衡二叉树，选 B。它一般不是满二叉树（n 不为 $2^k-1$ 时），也未必是完全二叉树（如 n=6 时最后一层有空洞），与最小生成树无关。"
  },
  {
    "id": "search-408-2017-q08",
    "title": "2017 年 408 真题第 8 题",
    "source": "2017 年 408 真题第 8 题",
    "difficulty": "进阶",
    "topics": [
      "折半查找",
      "判定树形态"
    ],
    "targetId": "search-408-2017-q08",
    "stem": "下列二叉树中，可能成为折半查找判定树（不含外部结点）的是（ ）。选项以 `1(2(3,_),4)` 式记法表示树形：括号内依次为左、右子树，`_` 表示空指针，标号仅为表述方便。",
    "options": [
      "`1(2(4(8,_),5(9,_)),3(6(10,_),7))`",
      "`1(2(4(8,_),5),3(6(_,10),7(_,9)))`",
      "`1(2(3(4,5),_),6(7(_,9),8(_,10)))`",
      "`1(2(4(8,_),5),3(6,7(9,10)))`"
    ],
    "answer": 0,
    "explanation": "折半查找的 mid 取整方式必须全程一致：mid=⌈(low+high)/2⌉ 时每次分割后左子区间长度 ≥ 右子区间，mid=⌊(low+high)/2⌋ 时左 ≤ 右。A 中每个结点分出的左子树结点数都 ≥ 右子树（10 分成 5+4，5 分成 2+2，2 分成 1+0 等），与向上取整规则全程一致，可能成为判定树；B、C、D 中既有左比右多（如 4 分 1+0）又有左比右少（如根分 4+5）的分割，违反单一取整规则。选 A。"
  },
  {
    "id": "search-408-2015-q07",
    "title": "2015 年 408 真题第 7 题",
    "source": "2015 年 408 真题第 7 题",
    "difficulty": "基础",
    "topics": [
      "折半查找",
      "比较序列"
    ],
    "targetId": "search-408-2015-q07",
    "stem": "下列选项中，不能构成折半查找中关键字比较序列的是（ ）。",
    "options": [
      "500，200，450，180",
      "500，450，200，180",
      "180，500，200，450",
      "180，200，500，450"
    ],
    "answer": 0,
    "explanation": "折半查找路径会持续收紧上下界。序列 A 中，比较 500 后向左、比较 200 后向右、比较 450 后又向左，此时后续关键字必须位于 200 与 450 之间，180 不可能出现。其余序列都能满足沿途形成的上下界，故选 A。"
  },
  {
    "id": "search-408-2016-q09",
    "title": "2016 年 408 真题第 9 题",
    "source": "2016 年 408 真题第 9 题",
    "difficulty": "进阶",
    "topics": [
      "顺序查找",
      "折半查找",
      "比较次数"
    ],
    "targetId": "search-408-2016-q09",
    "stem": "在有 $n$（$n>1000$）个元素的升序数组 A 中查找关键字 x。算法每次让 k 增加 3，再依次检查 `A[k]`、`A[k-1]`、`A[k-2]`。本算法与折半查找相比，有可能具有更少比较次数的情形是（ ）。",
    "code": "k = 0;\nwhile (k < n && A[k] < x) k = k + 3;\nif (k < n && A[k] == x) success;\nelse if (k - 1 < n && A[k - 1] == x) success;\nelse if (k - 2 < n && A[k - 2] == x) success;\nelse fail;",
    "options": [
      "当 x 不在数组中",
      "当 x 接近数组开头处",
      "当 x 接近数组结尾处",
      "当 x 位于数组中间位置"
    ],
    "answer": 1,
    "explanation": "该算法本质上按步长 3 从表头向后扫描，再检查当前小组。x 越靠近开头，需要经过的小组越少，可能只用常数次比较，少于折半查找约 $\\log_2 n$ 次的路径；位于中部、尾部或不存在时都可能扫描大量元素。故选 B。"
  },
  {
    "id": "search-408-2025-q07",
    "title": "2025 年 408 真题第 7 题",
    "source": "2025 年 408 真题第 7 题",
    "difficulty": "基础",
    "topics": [
      "分块查找",
      "最优块长"
    ],
    "targetId": "search-408-2025-q07",
    "stem": "已知查找表中有 400 个元素，各元素查找概率相同。采用均匀分块查找，使用顺序查找确定元素所在块，块内也使用顺序查找。为使效率最高，每块应包含（ ）个元素。",
    "options": [
      "8",
      "10",
      "20",
      "25"
    ],
    "answer": 2,
    "explanation": "设每块含 s 个元素，则块数为 $400/s$，两级顺序查找的主要代价与 $400/s+s$ 成正比。由均值不等式或求导可知在 $s=\\sqrt{400}=20$ 时最小，选 C。"
  },
  {
    "id": "search-wd72-q16",
    "title": "王道 7.2 节习题 16",
    "source": "王道《2026 年数据结构考研复习指导》7.2 节习题 16",
    "difficulty": "基础",
    "topics": [
      "分块查找",
      "组织方式"
    ],
    "targetId": "search-wd72-q16",
    "stem": "采用分块查找时，数据的组织方式为（ ）。",
    "options": [
      "数据分成若干块，每块内数据有序",
      "数据分成若干块，每块内数据不必有序，但块间必须有序，每块内最大（或最小）的数据组成索引块",
      "数据分成若干块，每块内数据有序，每块内最大（或最小）的数据组成索引块",
      "数据分成若干块，每块（除最后一块外）中数据个数需相同"
    ],
    "answer": 1,
    "explanation": "分块查找（索引顺序查找）只要求“块间有序”：前一块的最大关键字小于后一块的最小关键字；块内可以无序，查找时在块内用顺序查找。索引表由每块的最大（或最小）关键字构成，块长也不要求相等。选 B。"
  },
  {
    "id": "search-wd72-q17",
    "title": "王道 7.2 节习题 17",
    "source": "王道《2026 年数据结构考研复习指导》7.2 节习题 17",
    "difficulty": "进阶",
    "topics": [
      "分块查找",
      "最优块长"
    ],
    "targetId": "search-wd72-q17",
    "stem": "对有 2500 个记录的索引顺序表（分块表）进行查找，最理想的块长为（ ）。",
    "options": [
      "50",
      "125",
      "500",
      "$\\lceil\\log_2 2500\\rceil$"
    ],
    "answer": 0,
    "explanation": "设块长为 s，索引查找与块内查找都用顺序法时，成功 ASL 约为 $(n/s+1)/2+(s+1)/2$，主要项 $n/(2s)+s/2$ 在 $s=\\sqrt{n}$ 处取最小，即最理想块长为 $\\sqrt{2500}=50$。选 A。"
  }
]
