[
  {
    "id": "ch06-04-q01",
    "title": "不可实现的简单图度序列",
    "source": "严蔚敏《数据结构》/ OpenDSA Graph Terminology",
    "difficulty": "★★★",
    "topics": ["简单无向图", "度序列", "握手定理"],
    "targetId": "ch06-04-q01",
    "stem": "下列哪一个序列不可能是含 $4$ 个顶点的简单无向图的度序列？",
    "options": ["$3,2,2,1$", "$3,1,1,1$", "$3,3,3,1$", "$2,2,2,2$"],
    "answer": 2,
    "explanation": "**正确答案：C**\n\n**答案详解**\n\n度为 $3$ 的顶点必须与其余三个顶点都相邻。若有三个顶点的度都为 $3$，它们都必须与第四个顶点相邻，使第四个顶点的度至少为 $3$，不可能是 $1$。\n\n**选项辨析**\n\n- **A：错误。** 例如可由一个三角形再给其中一个顶点连一条边构成。\n- **B：错误。** 一个顶点连接其余三个顶点时，度序列正是 $3,1,1,1$。\n- **C：正确。** 三个度为 $3$ 的顶点会强制第四个顶点也至少为度 $3$。\n- **D：错误。** 四个顶点构成一个四环时，每个顶点的度都为 $2$。",
    "hint": "先利用“度为 $3$ 必须连接其余所有顶点”检查序列。",
    "points": 2
  },
  {
    "id": "ch06-04-q02",
    "title": "简单有向图最大边数",
    "source": "王道《数据结构》/ OpenDSA Graph Terminology",
    "difficulty": "★★",
    "topics": ["简单有向图", "最大边数"],
    "targetId": "ch06-04-q02",
    "stem": "一个不含自环和重边的简单有向图有 $6$ 个顶点，最多可以有多少条边？",
    "options": ["$15$", "$18$", "$30$", "$36$"],
    "answer": 2,
    "explanation": "**正确答案：C**\n\n**答案详解**\n\n每个顶点都可以向其余 $5$ 个不同顶点连一条边，方向不同的两条边可以同时存在。因此最大边数为 $6(6-1)=30$。\n\n**选项辨析**\n\n- **A：错误。** $6 × 5 / 2 = 15$ 是简单无向图的最大边数。\n- **B：错误。** 不是简单有向图最大边数的计算结果。\n- **C：正确。** 每个有序顶点对 $(u,v)$（$u ≠ v$）对应一条可能的有向边。\n- **D：错误。** $6^2$ 把不允许的自环也计入了。",
    "points": 2
  },
  {
    "id": "ch06-04-q03",
    "title": "自环与邻接矩阵对角线",
    "source": "严蔚敏《数据结构》/ OpenDSA Graph Implementations",
    "difficulty": "★★",
    "topics": ["邻接矩阵", "自环", "有向图"],
    "targetId": "ch06-04-q03",
    "stem": "用 $0/1$ 邻接矩阵存储一张有向图，约定 $A[i][j]=1$ 表示存在边 $i→j$。若 $A[3][3]=1$，它表示（ ）。",
    "options": ["顶点 $3$ 的入度为 $1$", "顶点 $3$ 的出度为 $1$", "存在一条以顶点 $3$ 为两个端点的自环", "顶点 $3$ 与所有其他顶点相邻"],
    "answer": 2,
    "explanation": "**正确答案：C**\n\n**答案详解**\n\n矩阵位置 $(i,j)$ 直接对应有向边 $i→j$。当行、列下标相同，$A[3][3]=1$ 表示边 $3→3$，即一条自环。\n\n**选项辨析**\n\n- **A：错误。** 单个矩阵单元不能给出顶点的完整入度。\n- **B：错误。** 单个矩阵单元同样不能给出完整出度。\n- **C：正确。** 行下标与列下标都为 $3$，对应 $3→3$。\n- **D：错误。** 与其他顶点是否相邻要查看第 $3$ 行或第 $3$ 列的其他位置。",
    "points": 2
  },
  {
    "id": "ch06-04-q04",
    "title": "点对查询的表示选择",
    "source": "CLRS 第 22 章 / OpenDSA Graph Implementations",
    "difficulty": "★★",
    "topics": ["邻接矩阵", "点对查询", "存储选型"],
    "targetId": "ch06-04-q04",
    "stem": "一张规模中等的图需要频繁判断任意指定顶点对 $u,v$ 是否直接相邻，且 $Θ(n²)$ 的空间可以接受。若不维护额外索引，优先选择（ ）。",
    "options": ["邻接矩阵", "未排序邻接表", "未排序边集数组", "每次查询都重新运行 BFS"],
    "answer": 0,
    "explanation": "**正确答案：A**\n\n**答案详解**\n\n邻接矩阵可直接访问 $A[u][v]$，指定边查询为 $Θ(1)$。题目已明确接受 $Θ(n²)$ 的空间，正符合矩阵的主要优势。\n\n**选项辨析**\n\n- **A：正确。** 一个数组访问即可判断该点对是否有边。\n- **B：错误。** 未排序邻接表最坏需扫描 $u$ 的全部邻接记录。\n- **C：错误。** 未排序边集数组最坏需扫描全部边。\n- **D：错误。** BFS 解决可达性，不是判断直接边的高效方式。",
    "points": 2
  },
  {
    "id": "ch06-04-q05",
    "title": "零权边的存在性",
    "source": "严蔚敏《数据结构》/ OpenDSA Graph Implementations",
    "difficulty": "★★★",
    "topics": ["带权图", "邻接矩阵", "零权边"],
    "targetId": "ch06-04-q05",
    "stem": "带权图允许权重为 $0$ 的边。使用邻接矩阵存储时，哪种设计能正确区分“无边”和“零权边”？",
    "options": ["约定数值 $0$ 一律表示无边", "用 `std::optional<Weight>` 的空值表示无边", "删除所有零权边", "把零权边统一改为权重 $1$"],
    "answer": 1,
    "explanation": "**正确答案：B**\n\n**答案详解**\n\n边是否存在与边的权重是不同的语义。`std::optional<Weight>` 的空状态表示无边；有值状态即使值为 $0$，也表示一条合法的零权边。\n\n**选项辨析**\n\n- **A：错误。** 会把合法的零权边误判为不存在。\n- **B：正确。** 显式分离了存在性与权重。\n- **C：错误。** 删除边会改变原图。\n- **D：错误。** 修改边权也会改变问题的语义和算法结果。",
    "points": 2
  },
  {
    "id": "ch06-04-q06",
    "title": "BFS 的最少边数路径",
    "source": "CLRS 第 22 章 / OpenDSA Graph Traversals",
    "difficulty": "★★",
    "topics": ["BFS", "无权图", "最短路径"],
    "targetId": "ch06-04-q06",
    "stem": "在无权图中，从 $s$ 到 $t$ 有路径 $s→a→t$ 和 $s→b→c→t$。从 $s$ 开始执行正确的 BFS，$t$ 被首次发现时记录的最少边数距离为（ ）。",
    "options": ["$1$", "$2$", "$3$", "无法由 BFS 判断"],
    "answer": 1,
    "explanation": "**正确答案：B**\n\n**答案详解**\n\n无权图中每条边都视为相同代价。BFS 按与起点的边数距离分层扩展，因此会先通过 $s→a→t$ 以两条边发现 $t$，得到最少边数距离 $2$。\n\n**选项辨析**\n\n- **A：错误。** 题中没有直接边 $s→t$。\n- **B：正确。** 路径 $s→a→t$ 恰有两条边。\n- **C：错误。** 另一条可行路径更长，不会覆盖 BFS 先得到的更短距离。\n- **D：错误。** 这正是 BFS 在无权图中的经典保证。",
    "hint": "BFS 的距离按经过的边数分层，而不是按顶点编号排序。",
    "points": 2
  },
  {
    "id": "ch06-04-q07",
    "title": "遍历策略与可达集合",
    "source": "CLRS 第 22 章 / OpenDSA Graph Traversals",
    "difficulty": "★★",
    "topics": ["DFS", "BFS", "可达性"],
    "targetId": "ch06-04-q07",
    "stem": "在同一张图中从同一起点 $s$ 执行正确的 DFS 与 BFS。下列说法正确的是（ ）。",
    "options": ["两者的访问顺序一定相同", "两者得到的搜索树边一定相同", "两者访问到的可达顶点集合相同", "DFS 只能用于无向图"],
    "answer": 2,
    "explanation": "**正确答案：C**\n\n**答案详解**\n\n两种算法都只沿图中存在的边从 $s$ 向外扩展，最终都会访问恰好从 $s$ 可达的顶点。邻接表顺序和策略不同会使访问顺序及搜索树不同。\n\n**选项辨析**\n\n- **A：错误。** BFS 分层访问，DFS 优先深入，顺序通常不同。\n- **B：错误。** 先发现某个顶点的边可能不同。\n- **C：正确。** 从同一起点出发的可达集合由图本身决定。\n- **D：错误。** DFS 同样适用于有向图。",
    "points": 2
  },
  {
    "id": "ch06-04-q08",
    "title": "完整遍历与连通分量",
    "source": "严蔚敏《数据结构》/ OpenDSA Graph Traversals",
    "difficulty": "★★",
    "topics": ["完整遍历", "无向图", "连通分量"],
    "targetId": "ch06-04-q08",
    "stem": "对无向图按顶点编号扫描；每当发现一个未访问顶点，就启动一次 DFS 并完成该次搜索。启动 DFS 的总次数等于（ ）。",
    "options": ["顶点数", "边数", "连通分量数", "所有顶点度数之和"],
    "answer": 2,
    "explanation": "**正确答案：C**\n\n**答案详解**\n\n一次 DFS 会恰好覆盖启动顶点所在的一个连通分量。外层扫描到下一个未访问顶点时，说明进入了另一个分量；因此启动次数正好等于连通分量数。\n\n**选项辨析**\n\n- **A：错误。** 同一连通分量中的多个顶点只需一次启动。\n- **B：错误。** 边数不决定需要启动多少次搜索。\n- **C：正确。** 每个连通分量对应搜索森林中的一棵树。\n- **D：错误。** 度数和等于 $2m$，与启动次数无直接对应关系。",
    "points": 2
  },
  {
    "id": "ch06-04-q09",
    "title": "单源覆盖与强连通",
    "source": "严蔚敏《数据结构》/ CLRS 第 22 章",
    "difficulty": "★★★",
    "topics": ["有向图", "单源可达", "强连通", "弱连通"],
    "targetId": "ch06-04-q09",
    "stem": "有向图的边为 $0→1$、$0→2$、$1→2$。从顶点 $0$ 出发可以访问全部顶点。关于该图，正确的是（ ）。",
    "options": ["图一定强连通", "图弱连通但不强连通", "图既不弱连通也不强连通", "顶点 $2$ 一定可以到达顶点 $0$"],
    "answer": 1,
    "explanation": "**正确答案：B**\n\n**答案详解**\n\n忽略方向后，$0$、$1$、$2$ 连成一个无向连通图，所以它弱连通。但是顶点 $2$ 没有到 $0$ 的有向路径，任意两点不能互相可达，因此不强连通。\n\n**选项辨析**\n\n- **A：错误。** 从一个起点能覆盖全图只说明该起点单向可达所有顶点。\n- **B：正确。** 忽略方向连通，但有向可达不对称。\n- **C：错误。** 底层无向图是连通的。\n- **D：错误。** 顶点 $2$ 没有出边。",
    "points": 2
  },
  {
    "id": "ch06-04-q10",
    "title": "只增边动态连通性",
    "source": "CLRS 并查集 / OpenDSA Graph Traversals",
    "difficulty": "★★★",
    "topics": ["并查集", "无向图", "动态连通性"],
    "targetId": "ch06-04-q10",
    "stem": "无向图初始没有边，之后反复执行“加入一条边”和“询问两个顶点当前是否连通”，且不需要输出具体路径。最合适的数据结构是（ ）。",
    "options": ["每次查询都重新运行 Floyd 算法", "带路径压缩和按大小合并的并查集", "每次加边后重建邻接矩阵", "Kosaraju 强连通分量算法"],
    "answer": 1,
    "explanation": "**正确答案：B**\n\n**答案详解**\n\n只增边的无向动态连通性可以用并查集维护：加边时合并两个集合，查询时比较两个顶点的代表元。路径压缩与按大小合并后，操作的均摊成本接近常数。\n\n**选项辨析**\n\n- **A：错误。** Floyd 面向全源最短路径，反复运行代价过高。\n- **B：正确。** 正好匹配只增边和连通性查询的操作模型。\n- **C：错误。** 矩阵重建会造成不必要的 $Θ(n²)$ 级工作。\n- **D：错误。** Kosaraju 用于有向图的强连通分量，不解决这个增量无向问题。",
    "points": 2
  }
]
