[
  {
    "id": "ch06-03-q01",
    "title": "单源遍历的覆盖范围",
    "source": "CLRS 第 22 章 / 严蔚敏《数据结构》",
    "difficulty": "★",
    "topics": ["单源遍历", "可达", "有向图"],
    "targetId": "ch06-03-q01",
    "stem": "有向图的顶点集为 $\\{0,1,2,3\\}$，边集为 $\\{0\\to1,1\\to2,3\\to2\\}$。从顶点 $0$ 启动一次 DFS 或 BFS，最终被访问的顶点集合是（ ）。",
    "options": ["$\\{0\\}$", "$\\{0,1\\}$", "$\\{0,1,2\\}$", "$\\{0,1,2,3\\}$"],
    "answer": 2,
    "explanation": "**正确答案：C**\n\n从 $0$ 可沿 $0\\to1\\to2$ 到达顶点 $1$、$2$，所以访问集合为 $\\{0,1,2\\}$。边 $3\\to2$ 的方向不能反过来走，因而无法从 $0$ 到达 $3$。DFS 与 BFS 的访问顺序可能不同，但从同一起点得到的可达集合相同。",
    "hint": "只沿箭头方向从 0 出发，不要因为 3 指向 2 就反向访问 3。",
    "points": 2
  },
  {
    "id": "ch06-03-q02",
    "title": "完整遍历的启动次数",
    "source": "严蔚敏《数据结构》/ OpenDSA Graph Traversals",
    "difficulty": "★★",
    "topics": ["完整遍历", "连通分量", "搜索森林"],
    "targetId": "ch06-03-q02",
    "stem": "无向图有顶点 $\\{0,1,2,3,4,5\\}$，边集为 $\\{\\{0,1\\},\\{1,2\\},\\{3,4\\}\\}$。按顶点编号从小到大扫描，每遇到未访问顶点就启动一次 BFS。总共会启动多少次 BFS？",
    "options": ["1 次", "2 次", "3 次", "4 次"],
    "answer": 2,
    "explanation": "**正确答案：C**\n\n第一次从 $0$ 出发覆盖 $\\{0,1,2\\}$；随后从 $3$ 出发覆盖 $\\{3,4\\}$；顶点 $5$ 是孤立点，还要单独启动一次。三次搜索对应三个连通分量，也形成包含三棵树的搜索森林。",
    "points": 2
  },
  {
    "id": "ch06-03-q03",
    "title": "发现时标记顶点",
    "source": "CLRS 第 22 章 / OpenDSA Graph Traversals",
    "difficulty": "★★",
    "topics": ["visited", "标记时机", "DFS", "BFS"],
    "targetId": "ch06-03-q03",
    "stem": "在基础 DFS/BFS 中，为避免同一顶点在等待期间被多个邻居重复加入栈或队列，最合适的标记时机是（ ）。",
    "options": ["首次发现并加入栈或队列时", "从栈或队列取出后", "扫描完整张图以后", "只有遇到环时才标记"],
    "answer": 0,
    "explanation": "**正确答案：A**\n\n顶点首次发现时就标记，之后其他邻居扫描到它便会跳过，因此每个顶点至多进入待处理结构一次。延迟到取出时才标记仍可能得到正确覆盖集合，但同一顶点可能在等待期间被重复加入，造成不必要的时间和空间开销。",
    "points": 2
  },
  {
    "id": "ch06-03-q04",
    "title": "邻居顺序与分量划分",
    "source": "严蔚敏《数据结构》/ CLRS 第 22 章",
    "difficulty": "★★",
    "topics": ["邻居顺序", "DFS", "BFS", "连通分量"],
    "targetId": "ch06-03-q04",
    "stem": "对同一张无向图改变各邻接表中的邻居顺序，再重新运行完整 DFS。下列哪一项一定不变？",
    "options": ["顶点发现顺序", "DFS 搜索树的边", "每个顶点的完成时间", "连通分量的顶点划分"],
    "answer": 3,
    "explanation": "**正确答案：D**\n\n邻居顺序会改变先深入哪条边，因此发现顺序、完成时间和搜索树都可能改变。但两个顶点是否属于同一连通分量由图中是否存在路径决定，与遍历时先选哪个邻居无关。任何正确的完整 DFS/BFS 都会得到相同的分量划分。",
    "points": 2
  },
  {
    "id": "ch06-03-q05",
    "title": "单向覆盖不等于强连通",
    "source": "CLRS 第 22 章 / 严蔚敏《数据结构》",
    "difficulty": "★★",
    "topics": ["强连通", "单源可达", "有向图"],
    "targetId": "ch06-03-q05",
    "stem": "有向图只有边 $0\\to1$、$1\\to2$。从 $0$ 出发能遍历全部顶点。关于整张图，下列说法正确的是（ ）。",
    "options": ["一定强连通", "弱连通但不强连通", "既不弱连通也不强连通", "顶点 2 一定能到达顶点 0"],
    "answer": 1,
    "explanation": "**正确答案：B**\n\n忽略方向后得到无向链 $0-1-2$，所以图弱连通。但 $2$ 没有出边，不能回到 $0$；从一个起点能到达全部顶点只证明单向覆盖，不能推出任意两点互相可达。",
    "points": 2
  },
  {
    "id": "ch06-03-q06",
    "title": "弱连通与强连通分量",
    "source": "严蔚敏《数据结构》/ CLRS 第 22 章",
    "difficulty": "★★★",
    "topics": ["弱连通分量", "强连通分量", "有向图"],
    "targetId": "ch06-03-q06",
    "stem": "有向图边集为 $\\{0\\to1,1\\to0,1\\to2,2\\to3,3\\to2\\}$。它的弱连通分量数与强连通分量数分别是（ ）。",
    "options": ["1 和 1", "1 和 2", "2 和 1", "2 和 2"],
    "answer": 1,
    "explanation": "**正确答案：B**\n\n忽略方向后，四个顶点通过边 $1-2$ 连成一体，所以只有一个弱连通分量。按有向可达看，$0$ 与 $1$ 互相可达，$2$ 与 $3$ 互相可达；虽然存在 $1\\to2$，却没有从后者返回前者的路径，因此 SCC 为 $\\{0,1\\}$ 和 $\\{2,3\\}$ 两个。",
    "points": 2
  },
  {
    "id": "ch06-03-q07",
    "title": "转置图强连通判定",
    "source": "CLRS 第 22 章 Strongly Connected Components",
    "difficulty": "★★★",
    "topics": ["强连通", "转置图", "可达"],
    "targetId": "ch06-03-q07",
    "stem": "对一张非空有向图任选顶点 $s$。下列哪组条件能够判定整张图强连通？",
    "options": ["只要求 $s$ 在原图中能到达全部顶点", "只要求转置图中全部顶点的入度非零", "要求从 $s$ 在原图和转置图中都能访问全部顶点", "要求忽略方向后从 $s$ 能访问全部顶点"],
    "answer": 2,
    "explanation": "**正确答案：C**\n\n原图中的遍历证明 $s$ 能到达任意顶点；转置图中的遍历等价于证明原图中任意顶点都能到达 $s$。两项同时成立时，对任意 $u,v$ 都有路径 $u\\leadsto s\\leadsto v$，所以图强连通。A 只有单向保证，B 不是可达条件，D 只能证明弱连通。",
    "points": 2
  },
  {
    "id": "ch06-03-q08",
    "title": "强连通分量的最大性",
    "source": "CLRS 第 22 章 / 严蔚敏《数据结构》",
    "difficulty": "★★",
    "topics": ["强连通分量", "最大顶点集合", "互相可达"],
    "targetId": "ch06-03-q08",
    "stem": "下列哪一项最准确地描述有向图的一个强连通分量？",
    "options": ["任意一条有向路径上的全部顶点", "任意两个顶点之间至少存在一条边的集合", "内部任意两点互相可达且不能继续扩大的顶点集合", "忽略方向后形成一棵树的顶点集合"],
    "answer": 2,
    "explanation": "**正确答案：C**\n\nSCC 要求集合内部任意两点都能沿有向路径互相到达，并且集合对这一性质是最大的。两点之间不必有直接边；弱连通或底层无向结构也不能代替双向有向可达。",
    "points": 2
  },
  {
    "id": "ch06-03-q09",
    "title": "凝聚图必为 DAG",
    "source": "CLRS 第 22 章 Strongly Connected Components",
    "difficulty": "★★★",
    "topics": ["SCC", "凝聚图", "DAG"],
    "targetId": "ch06-03-q09",
    "stem": "把有向图的每个强连通分量缩成一个顶点，并保留分量间的边。所得凝聚图一定具有哪项性质？",
    "options": ["一定是完全图", "一定是无环有向图", "一定是无向树", "所有顶点入度都为 1"],
    "answer": 1,
    "explanation": "**正确答案：B**\n\n若凝聚图存在有向环，则环上各分量可以沿环彼此到达并返回，原本就应合并成一个更大的 SCC，与强连通分量的最大性矛盾。因此凝聚图一定是 DAG，但不必是完全图或树，入度也没有固定值。",
    "points": 2
  },
  {
    "id": "ch06-03-q10",
    "title": "Kosaraju 的两轮顺序",
    "source": "CLRS 第 22 章 Strongly Connected Components",
    "difficulty": "★★★",
    "topics": ["Kosaraju", "完成顺序", "转置图"],
    "targetId": "ch06-03-q10",
    "stem": "采用“第一轮在原图上记录完成顺序”的 Kosaraju 实现时，第二轮应当怎样处理？",
    "options": ["在原图上按发现时间递增启动 BFS", "在转置图上按完成时间从大到小启动 DFS", "在转置图上按顶点入度从小到大启动 DFS", "忽略方向后只运行一次 DFS"],
    "answer": 1,
    "explanation": "**正确答案：B**\n\n第一轮在原图中于顶点完成时记录顺序；第二轮反转该顺序，也就是按完成时间从大到小扫描，并在转置图上收集 SCC。改用发现时间、入度或忽略方向都不能保证一次搜索恰好停留在同一个 SCC。",
    "hint": "记住组合：原图记完成顺序，转置图按完成时间递减收集。",
    "points": 2
  },
  {
    "id": "ch06-03-q11",
    "title": "Kosaraju 的复杂度",
    "source": "CLRS 第 22 章 / OpenDSA Graph Traversals",
    "difficulty": "★★",
    "topics": ["Kosaraju", "复杂度", "邻接表"],
    "targetId": "ch06-03-q11",
    "stem": "有向图以邻接表存储，$n=|V|$、$m=|E|$。构造转置图并执行两轮完整 DFS 的 Kosaraju 算法，时间复杂度为（ ）。",
    "options": ["$O(n)$", "$O(m)$", "$O(n+m)$", "$O(nm)$"],
    "answer": 2,
    "explanation": "**正确答案：C**\n\n构造转置图扫描全部顶点和边，需要 $O(n+m)$；两轮完整 DFS 各为 $O(n+m)$。常数次线性工作相加仍为 $O(n+m)$。只写 $O(m)$ 会漏掉孤立顶点，只写 $O(n)$ 会漏掉边扫描。",
    "points": 2
  },
  {
    "id": "ch06-03-q12",
    "title": "遍历与并查集选型",
    "source": "CLRS Disjoint-set Data Structures / OpenDSA Graph Traversals",
    "difficulty": "★★★",
    "topics": ["并查集", "动态连通性", "DFS", "BFS"],
    "targetId": "ch06-03-q12",
    "stem": "一张无向图初始没有边，之后只执行“加入一条边”和“询问两点当前是否连通”，且操作次数很多。若不要求输出实际路径，优先选择（ ）。",
    "options": ["每次查询都重新运行 Floyd", "带路径压缩和按大小合并的并查集", "每次加入边都重建邻接矩阵并排序", "Kosaraju 强连通分量算法"],
    "answer": 1,
    "explanation": "**正确答案：B**\n\n只增边的无向动态连通性正适合并查集：加边执行 `unite`，查询执行 `find`，优化后均摊成本接近常数。重新遍历也能回答静态时刻的连通性，但大量交错操作下代价更高；Kosaraju 面向有向 SCC，Floyd 面向全源最短路径。",
    "points": 2
  }
]
