[
  {
    "id": "ds-drill-radix-sort-001",
    "title": "理论巩固题",
    "source": "自编理论题",
    "difficulty": "★★",
    "topics": [
      "radix sort"
    ],
    "targetId": "ds-drill-radix-sort-001",
    "stem": "基数排序通常采用什么策略？",
    "options": [
      "最高位优先 MSD",
      "最低位优先 LSD",
      "随机位",
      "中间位优先"
    ],
    "answer": 1,
    "explanation": "基数排序通常采用 LSD（最低位优先），先排低位再排高位。"
  },
  {
    "id": "ds-drill-radix-sort-002",
    "title": "理论巩固题",
    "source": "自编理论题",
    "difficulty": "★★",
    "topics": [
      "radix sort"
    ],
    "targetId": "ds-drill-radix-sort-002",
    "stem": "基数排序每一趟（对某一位）用什么排序？",
    "options": [
      "快速排序",
      "稳定排序（如计数排序按位分桶）",
      "冒泡排序",
      "堆排序"
    ],
    "answer": 1,
    "explanation": "基数排序每趟按某一位做稳定排序（通常用计数排序按位分配），稳定性是关键。"
  },
  {
    "id": "ds-drill-radix-sort-003",
    "title": "理论巩固题",
    "source": "自编理论题",
    "difficulty": "★★",
    "topics": [
      "radix sort"
    ],
    "targetId": "ds-drill-radix-sort-003",
    "stem": "基数排序为什么每一位都必须稳定？",
    "options": [
      "提高速度",
      "保证高位排序不会打乱低位已排好的顺序",
      "节省空间",
      "避免溢出"
    ],
    "answer": 1,
    "explanation": "若十位排序不稳定，同十位不同个位的数（23、27）可能被打乱，个位白排。"
  },
  {
    "id": "ds-drill-radix-sort-004",
    "title": "理论巩固题",
    "source": "自编理论题",
    "difficulty": "★★",
    "topics": [
      "radix sort"
    ],
    "targetId": "ds-drill-radix-sort-004",
    "stem": "基数排序的时间复杂度是？",
    "options": [
      "O(n²)",
      "O(n log n)",
      "O(d(n + r))",
      "O(n + k)"
    ],
    "answer": 2,
    "explanation": "d 位、基数 r，每趟分配收集 O(n+r)，总 O(d(n+r))。"
  },
  {
    "id": "ds-drill-radix-sort-005",
    "title": "理论巩固题",
    "source": "自编理论题",
    "difficulty": "★★",
    "topics": [
      "radix sort"
    ],
    "targetId": "ds-drill-radix-sort-005",
    "stem": "关于基数排序的稳定性，下列说法正确的是？",
    "options": [
      "不稳定，因为按位排序",
      "稳定，前提是每一位排序都稳定",
      "不稳定，因为 LSD 策略",
      "稳定性取决于基数大小"
    ],
    "answer": 1,
    "explanation": "前提是每一位排序都稳定，则整体稳定；基数排序稳定。"
  },
  {
    "id": "ds-drill-radix-sort-006",
    "title": "理论巩固题",
    "source": "自编理论题",
    "difficulty": "★★",
    "topics": [
      "radix sort"
    ],
    "targetId": "ds-drill-radix-sort-006",
    "stem": "基数排序为什么能突破比较排序的 Ω(n log n) 下界？",
    "options": [
      "它比较更快",
      "它利用关键字的位结构（按位分解），不基于元素间比较",
      "它用了分治",
      "它总是更快"
    ],
    "answer": 1,
    "explanation": "基数排序按位分桶，不直接比较元素大小，故不适用比较排序的决策树下界。"
  },
  {
    "id": "ds-drill-radix-sort-007",
    "title": "理论巩固题",
    "source": "自编理论题",
    "difficulty": "★★★",
    "topics": [
      "radix sort"
    ],
    "targetId": "ds-drill-radix-sort-007",
    "stem": "若 32 位整数按字节分解，则 d 和 r 分别是？",
    "options": [
      "d=4, r=256",
      "d=32, r=2",
      "d=4, r=4",
      "d=256, r=4"
    ],
    "answer": 0,
    "explanation": "32 位整数按字节（8 位）分解：d=32/8=4 位，每位基数 r=2^8=256，此时可看作线性 O(n)。"
  },
  {
    "id": "ds-drill-radix-sort-008",
    "title": "理论巩固题",
    "source": "自编理论题",
    "difficulty": "★★★",
    "topics": [
      "radix sort"
    ],
    "targetId": "ds-drill-radix-sort-008",
    "stem": "基数排序适用于什么数据？",
    "options": [
      "任意浮点数",
      "关键字可表示为若干位的数据（整数、定长字符串）",
      "值域连续的实数",
      "无序的任意对象"
    ],
    "answer": 1,
    "explanation": "基数排序要求关键字能按位分解，如十进制整数、字符串、定长字串。"
  },
  {
    "id": "ds-drill-radix-sort-009",
    "title": "理论巩固题",
    "source": "自编理论题",
    "difficulty": "★★★",
    "topics": [
      "radix sort"
    ],
    "targetId": "ds-drill-radix-sort-009",
    "stem": "LSD 基数排序的处理顺序是？",
    "options": [
      "先最高位后最低位",
      "先最低位后最高位",
      "随机位",
      "只处理最低位"
    ],
    "answer": 1,
    "explanation": "LSD（Least Significant Digit）从最低位开始，逐位向最高位处理。"
  },
  {
    "id": "ds-drill-radix-sort-010",
    "title": "理论巩固题",
    "source": "自编理论题",
    "difficulty": "★★★",
    "topics": [
      "radix sort"
    ],
    "targetId": "ds-drill-radix-sort-010",
    "stem": "基数排序与计数排序的关系是？",
    "options": [
      "完全无关",
      "基数排序每一趟本质是一次按位的稳定计数排序",
      "计数排序是基数排序的特殊情况",
      "两者都是比较排序"
    ],
    "answer": 1,
    "explanation": "基数排序每趟按当前位做稳定计数排序（分配收集）。"
  }
]
