[
  {
    "id": "ch06-02-q01",
    "title": "无向图邻接矩阵性质",
    "source": "严蔚敏《数据结构》/ OpenDSA Graph Implementations",
    "difficulty": "★",
    "topics": ["邻接矩阵", "无向图", "对称性"],
    "targetId": "ch06-02-q01",
    "stem": "用 $0/1$ 邻接矩阵存储一张不含自环的简单无向图。下列说法正确的是（ ）。",
    "options": ["矩阵一定关于主对角线对称", "矩阵每一行的元素和都相等", "主对角线元素必须全部为 1", "矩阵的上三角和下三角可以表示两张不同的图"],
    "answer": 0,
    "explanation": "**正确答案：A**\n\n**答案详解**\n\n无向边 $\\{u,v\\}$ 同时表示 $u$ 与 $v$ 相邻，因此 $A[u][v]=A[v][u]$，矩阵关于主对角线对称。不含自环时主对角线为 $0$。\n\n**选项辨析**\n\n- **A：正确。** 每条无向边对应两个对称位置。\n- **B：错误。** 每行元素和是对应顶点的度，不同顶点的度可以不同。\n- **C：错误。** 不含自环时 $A[i][i]=0$。\n- **D：错误。** 两个三角区是同一批无向边的对称副本。",
    "points": 2
  },
  {
    "id": "ch06-02-q02",
    "title": "有向矩阵的行列含义",
    "source": "王道《数据结构》/ 严蔚敏《数据结构》",
    "difficulty": "★★",
    "topics": ["邻接矩阵", "有向图", "入度", "出度"],
    "targetId": "ch06-02-q02",
    "stem": "有向图包含边 $0\\to1$、$0\\to2$、$2\\to1$、$1\\to3$。若邻接矩阵第 $i$ 行表示从 $i$ 出发的边，则顶点 $1$ 的入度和出度分别为（ ）。",
    "options": ["$1,2$", "$2,1$", "$2,2$", "$1,1$"],
    "answer": 1,
    "explanation": "**正确答案：B**\n\n**答案详解**\n\n指向顶点 $1$ 的边有 $0\\to1$、$2\\to1$，所以入度为 $2$；从顶点 $1$ 出发的边只有 $1\\to3$，所以出度为 $1$。矩阵中第 $1$ 列的非零项数是入度，第 $1$ 行的非零项数是出度。\n\n**选项辨析**\n\n- **A：错误。** 把行、列含义交换了。\n- **B：正确。** 两条入边、一条出边。\n- **C：错误。** 把指向 $1$ 的两条边也都算成了出边。\n- **D：错误。** 漏掉了一条指向 $1$ 的边。",
    "hint": "先数指向 1 的箭头，再数从 1 出发的箭头。",
    "points": 2
  },
  {
    "id": "ch06-02-q03",
    "title": "无向邻接表的记录数",
    "source": "严蔚敏《数据结构》/ CLRS 第 22 章",
    "difficulty": "★★",
    "topics": ["邻接表", "无向图", "逻辑边", "邻接记录"],
    "targetId": "ch06-02-q03",
    "stem": "一张不含自环的简单无向图有 $m=7$ 条逻辑边。若邻接表为每条无向边分别保存 $u\\to v$ 与 $v\\to u$ 两条邻接记录，则所有邻接表长度之和为（ ）。",
    "options": ["7", "9", "14", "49"],
    "answer": 2,
    "explanation": "**正确答案：C**\n\n**答案详解**\n\n每条无向逻辑边在两个端点的邻接表中各出现一次，所以记录总数为 $2m=14$。这不会把图论边数改成 $14$；逻辑边仍只有 $7$ 条。\n\n**选项辨析**\n\n- **A：错误。** 这是逻辑边数，未计双向邻接记录。\n- **B：错误。** 记录数与顶点数或额外常数无此固定关系。\n- **C：正确。** 每条边贡献两条邻接记录。\n- **D：错误。** $m^2$ 与邻接表记录数无关。",
    "points": 2
  },
  {
    "id": "ch06-02-q04",
    "title": "大规模稀疏图选型",
    "source": "王道《数据结构》/ OpenDSA Graph Implementations",
    "difficulty": "★★",
    "topics": ["邻接表", "邻接矩阵", "稀疏图", "空间复杂度"],
    "targetId": "ch06-02-q04",
    "stem": "有 $100\\,000$ 个顶点、$300\\,000$ 条有向边，并且算法需要频繁枚举每个顶点的实际出邻居。下列主要存储方式最合适的是（ ）。",
    "options": ["邻接表", "$100\\,000\\times100\\,000$ 的邻接矩阵", "只保存顶点数组而不保存边", "为每个顶点保存一份完整矩阵"],
    "answer": 0,
    "explanation": "**正确答案：A**\n\n**答案详解**\n\n该图的边数远小于 $n^2$，且高频操作是枚举真实邻居。邻接表只保存 $n$ 个表头和 $m$ 条出边记录，空间为 $\\Theta(n+m)$，枚举顶点 $u$ 的邻居为 $\\Theta(\\deg^+(u))$。\n\n**选项辨析**\n\n- **A：正确。** 同时匹配稀疏性与邻居枚举需求。\n- **B：错误。** 需要 $10^{10}$ 个矩阵单元，且枚举邻居要扫描整行。\n- **C：错误。** 不保存边就无法恢复邻接关系。\n- **D：错误。** 比单个邻接矩阵还要多出一个顶点数量级的空间浪费。",
    "points": 2
  },
  {
    "id": "ch06-02-q05",
    "title": "邻接矩阵操作复杂度",
    "source": "CLRS 第 22 章 / OpenDSA Graph Implementations",
    "difficulty": "★★",
    "topics": ["邻接矩阵", "相邻查询", "邻居枚举", "复杂度"],
    "targetId": "ch06-02-q05",
    "stem": "对含 $n$ 个顶点的图使用普通邻接矩阵。判断指定边 $u\\to v$ 是否存在，以及枚举顶点 $u$ 的全部邻居，时间复杂度分别为（ ）。",
    "options": ["$\\Theta(1)$；$\\Theta(n)$", "$\\Theta(n)$；$\\Theta(1)$", "$\\Theta(m)$；$\\Theta(n+m)$", "$\\Theta(n^2)$；$\\Theta(n^2)$"],
    "answer": 0,
    "explanation": "**正确答案：A**\n\n**答案详解**\n\n指定边查询只访问单元 $A[u][v]$，所以是 $\\Theta(1)$。枚举 $u$ 的邻居必须检查第 $u$ 行的全部 $n$ 个单元，即使其中大多为零，所以是 $\\Theta(n)$。\n\n**选项辨析**\n\n- **A：正确。** 直接索引快，但邻居枚举仍需扫描整行。\n- **B：错误。** 把两项复杂度颠倒了。\n- **C：错误。** 这是把边集扫描或邻接表全图扫描的量级混入矩阵。\n- **D：错误。** 单次点对查询和单行扫描都不需要扫描整个矩阵。",
    "points": 2
  },
  {
    "id": "ch06-02-q06",
    "title": "动态数组邻接表操作复杂度",
    "source": "CLRS 第 22 章 / OpenDSA Graph Implementations",
    "difficulty": "★★★",
    "topics": ["邻接表", "动态数组", "相邻查询", "复杂度"],
    "targetId": "ch06-02-q06",
    "stem": "邻接表的每个顶点使用未排序动态数组保存出边，且没有额外索引。忽略取得表头的常数操作，最坏情况下判断指定边 $u\\to v$ 是否存在所需检查的邻接记录数，以及完整枚举 $u$ 的全部出邻居所需访问的邻接记录数，分别是（ ）。",
    "options": ["最多 $1$ 条；恰好 $1$ 条", "最多 $\\deg^+(u)$ 条；恰好 $\\deg^+(u)$ 条", "最多 $n$ 条；恰好 $n$ 条", "最多 $m$ 条；恰好 $m$ 条"],
    "answer": 1,
    "explanation": "**正确答案：B**\n\n**答案详解**\n\n没有哈希或有序索引时，若 $v$ 不在列表中或位于末尾，必须检查 $u$ 的全部 $\\deg^+(u)$ 条出边记录；完整枚举也恰好访问这些真实记录。因此两项时间成本都随 $u$ 的出度线性增长，通常写为 $O(\\deg^+(u))$ 与 $\\Theta(\\deg^+(u))$。\n\n**选项辨析**\n\n- **A：错误。** 动态数组尾部添加可摊还 $O(1)$，不代表按目标顶点查询或完整枚举只访问一条记录。\n- **B：正确。** 最坏查询会检查全部记录，完整枚举也逐条访问全部记录。\n- **C：错误。** 邻接表不为不存在的点对保存记录，无需访问全部 $n$ 个顶点对应的位置。\n- **D：错误。** 无需扫描全图的所有 $m$ 条边，只扫描 $u$ 的列表。",
    "hint": "先写明“未排序动态数组、无额外索引”这个实现前提。",
    "points": 2
  },
  {
    "id": "ch06-02-q07",
    "title": "图表示改变遍历复杂度",
    "source": "王道《数据结构》/ CLRS 第 22 章",
    "difficulty": "★★★",
    "topics": ["邻接矩阵", "邻接表", "图遍历", "复杂度"],
    "targetId": "ch06-02-q07",
    "stem": "同一套“访问每个顶点并检查其全部邻居”的完整图遍历，使用邻接矩阵与邻接表时，时间复杂度通常分别为（ ）。",
    "options": ["$\\Theta(n+m)$；$\\Theta(n^2)$", "$\\Theta(n^2)$；$\\Theta(n+m)$", "$\\Theta(m)$；$\\Theta(n)$", "两者始终都是 $\\Theta(n+m)$"],
    "answer": 1,
    "explanation": "**正确答案：B**\n\n**答案详解**\n\n矩阵中每访问一个顶点都要扫描长度为 $n$ 的整行，共 $n$ 行，因此为 $\\Theta(n^2)$。邻接表只扫描所有顶点和真实邻接记录，所有列表长度总和与 $m$ 同阶，因此为 $\\Theta(n+m)$。\n\n**选项辨析**\n\n- **A：错误。** 把两种表示的复杂度交换了。\n- **B：正确。** 矩阵扫描全部点对，邻接表扫描顶点与真实边。\n- **C：错误。** 两项都漏掉了必要工作。\n- **D：错误。** $\\Theta(n+m)$ 隐含邻接表或等价稀疏结构前提。",
    "points": 2
  },
  {
    "id": "ch06-02-q08",
    "title": "零权边的矩阵表示",
    "source": "严蔚敏《数据结构》/ OpenDSA Graph Implementations",
    "difficulty": "★★★",
    "topics": ["带权图", "邻接矩阵", "零权边", "optional"],
    "targetId": "ch06-02-q08",
    "stem": "带权图允许权重为 $0$ 的边。若使用邻接矩阵，下列设计最能避免把“零权边”误判为“没有边”的是（ ）。",
    "options": ["规定矩阵值为 0 一律表示没有边", "用 `std::optional<Weight>` 或独立存在位区分边是否存在", "把所有零权边直接删除", "把零权边的权重自动改成 1"],
    "answer": 1,
    "explanation": "**正确答案：B**\n\n**答案详解**\n\n边是否存在与边权是多少是两个不同维度。`optional` 的空状态表示无边，有值状态即使保存 $0$ 也表示合法边；独立布尔存在位同理。\n\n**选项辨析**\n\n- **A：错误。** 会让合法零权边与无边发生语义冲突。\n- **B：正确。** 显式分离存在性与权值。\n- **C：错误。** 删除零权边会改变原图及算法结果。\n- **D：错误。** 修改权重同样改变了问题语义。",
    "points": 2
  },
  {
    "id": "ch06-02-q09",
    "title": "边集数组的典型用途",
    "source": "CLRS Kruskal/Bellman-Ford 相关章节 / 王道《数据结构》",
    "difficulty": "★★",
    "topics": ["边集数组", "Kruskal", "全边扫描", "存储选型"],
    "targetId": "ch06-02-q09",
    "stem": "下列任务最适合直接以边集数组作为主要输入表示的是（ ）。",
    "options": ["反复枚举某一个顶点的全部邻居", "按边权排序后执行 Kruskal 算法", "以 $O(1)$ 时间查询任意指定点对是否相邻", "统计邻接矩阵每一行的非零项"],
    "answer": 1,
    "explanation": "**正确答案：B**\n\n**答案详解**\n\nKruskal 的核心步骤就是把全部边按权重排序，再依次扫描；边集数组天然按边组织，最便于排序和线性处理。它不擅长按顶点枚举邻居或查询指定点对。\n\n**选项辨析**\n\n- **A：错误。** 边集数组最坏要扫描全部 $m$ 条边，邻接表更合适。\n- **B：正确。** 排序全部边正是边集数组的优势。\n- **C：错误。** 无索引边集数组查询指定边需 $O(m)$。\n- **D：错误。** 该任务本身已经假定使用邻接矩阵。",
    "points": 2
  },
  {
    "id": "ch06-02-q10",
    "title": "遍历与查询兼顾的混合表示",
    "source": "OpenDSA Graph Implementations / CLRS 图的表示",
    "difficulty": "★★★★",
    "topics": ["邻接表", "哈希索引", "混合表示", "工程选型"],
    "targetId": "ch06-02-q10",
    "stem": "一个大规模稀疏社交图既要频繁枚举用户的好友，又要频繁判断两人是否直接相连。若可以用额外空间换查询速度，下列设计最合理的是（ ）。",
    "options": ["只用邻接矩阵", "只用无索引边集数组", "以动态数组实现的邻接表为主存储，并维护哈希索引加速指定边查询", "每次查询前把整张图重新排序"],
    "answer": 2,
    "explanation": "**正确答案：C**\n\n**答案详解**\n\n动态数组实现的邻接表保留稀疏图的 $\\Theta(n+m)$ 级空间和高效邻居枚举；哈希索引把指定边查询的期望时间降到接近 $O(1)$。代价是额外内存、哈希常数和同步责任，更新边时必须同时维护两个视图。\n\n**选项辨析**\n\n- **A：错误。** 大规模稀疏图使用 $\\Theta(n^2)$ 矩阵通常空间不可接受。\n- **B：错误。** 边集数组既不便于枚举单个顶点邻居，也不便于查询指定边。\n- **C：正确。** 分别优化高频遍历和高频点对查询。\n- **D：错误。** 每次全图排序成本高，也不能直接提供稳定的常数期望查询。",
    "hint": "两类高频操作可以由主存储和辅助索引分别服务。",
    "points": 2
  }
]
